{
  "$schema": "https://json-schema.org/draft/2020-12/schema",
  "title": "PlaybackTicketStatus",
  "description": "Safe GET projection of a playback ticket. It never contains transport descriptions, stream URLs, source URLs, source headers, or media-session capabilities. Use create or refresh to obtain a one-time consuming description.",
  "type": "object",
  "additionalProperties": false,
  "required": [
    "ticket_id",
    "state",
    "contract_version",
    "expires_at",
    "remaining_transports"
  ],
  "properties": {
    "ticket_id": {
      "type": "string",
      "pattern": "^pt_[A-Za-z0-9_-]{8,96}$"
    },
    "state": {
      "$ref": "playback-ticket-state.schema.json"
    },
    "contract_version": {
      "const": 1
    },
    "expires_at": {
      "type": "string",
      "format": "date-time"
    },
    "media": {
      "$ref": "media.schema.json"
    },
    "remaining_transports": {
      "type": "array",
      "maxItems": 4,
      "uniqueItems": true,
      "items": {
        "$ref": "playback-transport-kind.schema.json"
      }
    },
    "message": {
      "type": "string",
      "minLength": 1,
      "maxLength": 2048
    },
    "failure_code": {
      "$ref": "playback-failure-code.schema.json"
    }
  },
  "allOf": [
    {
      "if": {
        "properties": {
          "state": {
            "const": "probing"
          }
        },
        "required": [
          "state"
        ]
      },
      "then": {
        "properties": {
          "media": false,
          "remaining_transports": {
            "maxItems": 0
          }
        }
      }
    },
    {
      "if": {
        "properties": {
          "state": {
            "const": "unsupported"
          }
        },
        "required": [
          "state"
        ]
      },
      "then": {
        "required": [
          "failure_code"
        ],
        "properties": {
          "failure_code": {
            "const": "unsupported_media"
          }
        }
      }
    },
    {
      "if": {
        "properties": {
          "state": {
            "const": "failed"
          }
        },
        "required": [
          "state"
        ]
      },
      "then": {
        "required": [
          "failure_code"
        ],
        "properties": {
          "failure_code": {
            "enum": [
              "source_unavailable",
              "probe_timeout",
              "probe_interrupted",
              "probe_finalize_failed"
            ]
          }
        }
      }
    },
    {
      "if": {
        "properties": {
          "state": {
            "const": "ready"
          }
        },
        "required": [
          "state"
        ]
      },
      "then": {
        "required": [
          "media"
        ],
        "properties": {
          "media": true,
          "remaining_transports": {
            "minItems": 1
          }
        }
      }
    },
    {
      "if": {
        "properties": {
          "state": {
            "const": "consuming"
          }
        },
        "required": [
          "state"
        ]
      },
      "then": {
        "required": [
          "media"
        ],
        "properties": {
          "media": true
        }
      }
    },
    {
      "if": {
        "properties": {
          "state": {
            "enum": [
              "unsupported",
              "failed",
              "expired",
              "revoked",
              "exhausted"
            ]
          }
        },
        "required": [
          "state"
        ]
      },
      "then": {
        "required": [
          "message"
        ],
        "properties": {
          "message": true,
          "remaining_transports": {
            "maxItems": 0
          }
        }
      }
    },
    {
      "if": {
        "properties": {
          "state": {
            "const": "exhausted"
          }
        },
        "required": [
          "state"
        ]
      },
      "then": {
        "required": [
          "media"
        ],
        "properties": {
          "media": true
        }
      }
    },
    {
      "if": {
        "properties": {
          "state": {
            "not": {
              "enum": [
                "unsupported",
                "failed"
              ]
            }
          }
        },
        "required": [
          "state"
        ]
      },
      "then": {
        "properties": {
          "failure_code": false
        }
      }
    }
  ]
}
